{
  "$schema": "../manifests/schemas/source-acquisition-evidence.schema.json",
  "schemaVersion": 1,
  "kind": "hvp-native-source-acquisition-evidence",
  "sourceLockSha256": "f8808cf258d9913ec1ed02d3e1143ad3abe7ad90cd3cc8052258b30afd90e935",
  "archiveCount": 13,
  "archives": [
    { "id": "fast-float", "version": "libplacebo-submodule", "commit": "2b2395f9ac836ffca6404424bcc252bff7aa80e4", "archiveName": "fast-float.tar.gz", "sourceUrl": "https://github.com/fastfloat/fast_float/archive/2b2395f9ac836ffca6404424bcc252bff7aa80e4.tar.gz", "sha256": "230d20e4e4ac1f6a9df92c4d746c6ec536cdb0c085bc8635d4b88cead5dc22cb", "length": 84808 },
    { "id": "ffmpeg", "version": "n6.1.6", "commit": "f1e3a2bf7a2f2cde936d1ed97f09a26853d20125", "archiveName": "ffmpeg-6.1.6.tar.xz", "sourceUrl": "https://ffmpeg.org/releases/ffmpeg-6.1.6.tar.xz", "sha256": "d4fcb164028dd3beee5d92c0ac72e46aac6973c75ea12dc14de07bf8f407370a", "length": 10497884 },
    { "id": "freetype", "version": "VER-2-14-3", "commit": "0a0221a1347e2f1e07c395263540026e9a0aa7c7", "archiveName": "freetype.tar.gz", "sourceUrl": "https://github.com/freetype/freetype/archive/0a0221a1347e2f1e07c395263540026e9a0aa7c7.tar.gz", "sha256": "11cd478953fc1d382f20a233b8e2aed6c31b47cbf0568c4bdb3334bcc1550698", "length": 2517889 },
    { "id": "fribidi", "version": "v1.0.16", "commit": "68162babff4f39c4e2dc164a5e825af93bda9983", "archiveName": "fribidi.tar.gz", "sourceUrl": "https://github.com/fribidi/fribidi/archive/68162babff4f39c4e2dc164a5e825af93bda9983.tar.gz", "sha256": "fa34a057a414c85f7e1f3c0fd717bc93d74d370ed474ef2feca90868b4938f72", "length": 2144204 },
    { "id": "glslang", "version": "16.5.0", "commit": "a8d28bd082bff18ffbe80996e922b012f915cf07", "archiveName": "glslang.tar.gz", "sourceUrl": "https://github.com/KhronosGroup/glslang/archive/a8d28bd082bff18ffbe80996e922b012f915cf07.tar.gz", "sha256": "a2e64a2803b8f7a8926d401cb13f3774ccf8517986fc065a285ce349fae5fe50", "length": 4598499 },
    { "id": "harfbuzz", "version": "14.3.1", "commit": "ab5ecbb83985034a76214ac0b2b833dcd590d774", "archiveName": "harfbuzz.tar.xz", "sourceUrl": "https://github.com/harfbuzz/harfbuzz/releases/download/14.3.1/harfbuzz-14.3.1.tar.xz", "sha256": "9dae9538aae2ffdf70cec31f2c27bf68e2aaeeae3112688467697d5faf6194f7", "length": 19826476 },
    { "id": "jinja", "version": "libplacebo-build-input", "commit": "b08cd4bc64bb980df86ed2876978ae5735572280", "archiveName": "jinja.tar.gz", "sourceUrl": "https://github.com/pallets/jinja/archive/b08cd4bc64bb980df86ed2876978ae5735572280.tar.gz", "sha256": "9a20bab550a760ccb9b38a45d4fe76be92649206ee04633c646d0935a1872b0e", "length": 273377 },
    { "id": "libass", "version": "0.17.5", "commit": "4a05d8127f525943ebf45fdc6497c9e665947f0d", "archiveName": "libass-0.17.5.tar.xz", "sourceUrl": "https://github.com/libass/libass/releases/download/0.17.5/libass-0.17.5.tar.xz", "sha256": "2dca25c0e0c837ddf00b52011b3f82cac1e4ddd3ad018227806b0c2288864acc", "length": 460148 },
    { "id": "libplacebo", "version": "v6.338.2", "commit": "64c1954570f1cd57f8570a57e51fb0249b57bb90", "archiveName": "libplacebo.tar.gz", "sourceUrl": "https://github.com/haasn/libplacebo/archive/64c1954570f1cd57f8570a57e51fb0249b57bb90.tar.gz", "sha256": "3144bb66bc9e286da37f17f71886d65a6d1baf9e45e4efa5ac8bd61ffa935487", "length": 841908 },
    { "id": "markupsafe", "version": "libplacebo-build-input", "commit": "c0254f0cfe51720ecc9e72e8896022af29af5b44", "archiveName": "markupsafe.tar.gz", "sourceUrl": "https://github.com/pallets/markupsafe/archive/c0254f0cfe51720ecc9e72e8896022af29af5b44.tar.gz", "sha256": "1826c5d89cc1aa0b3088f538726d339e0c5cd69fbe03f7b8f9a3f880474d1120", "length": 24175 },
    { "id": "mpv", "version": "v0.41.0", "commit": "41f6a645068483470267271e1d09966ca3b9f413", "archiveName": "mpv.tar.gz", "sourceUrl": "https://github.com/mpv-player/mpv/archive/41f6a645068483470267271e1d09966ca3b9f413.tar.gz", "sha256": "068960e89211f2adc80af03f637fa393fb5e407d3dd23592c8fe8c5490bb7ae4", "length": 7264274 },
    { "id": "spirv-cross", "version": "vulkan-sdk-1.4.357.0", "commit": "6c09849fe88c48eaed08413aa022aaa136a3a057", "archiveName": "spirv-cross.tar.gz", "sourceUrl": "https://github.com/KhronosGroup/SPIRV-Cross/archive/6c09849fe88c48eaed08413aa022aaa136a3a057.tar.gz", "sha256": "b81b9956289950570953738e666a031ca32ff64e4fc925eba89f227c42109518", "length": 2007157 },
    { "id": "zlib", "version": "v1.3.2", "commit": "da607da739fa6047df13e66a2af6b8bec7c2a498", "archiveName": "zlib-1.3.2.tar.xz", "sourceUrl": "https://zlib.net/zlib-1.3.2.tar.xz", "sha256": "d7a0654783a4da529d1bb793b7ad9c3318020af77667bcae35f95d0e42a792f3", "length": 1320064 }
  ]
}
